{"$schema":"https://json-schema.org/draft/2020-12/schema","type":"object","additionalProperties":false,"required":["schema_version","order_id","hypothesis_id","evidence_tier","edge_claim","producing_git_commit","source_binding","capacity","validation_seal","authorizations","access_counts","lifecycle"],"properties":{"schema_version":{"const":"lily_l4_b87_capacity_report_v1"},"order_id":{"const":"B8.7"},"hypothesis_id":{"const":"L-4"},"evidence_tier":{"const":"E0"},"edge_claim":{"const":"none"},"producing_git_commit":{"type":"string","pattern":"^[0-9a-f]{40}$"},"source_binding":{"type":"object"},"capacity":{"type":"object"},"validation_seal":{"const":{"status":"sealed_not_accessed","accessed":false}},"authorizations":{"type":"object"},"access_counts":{"type":"object"},"lifecycle":{"type":"object"}}}
