{"schema_version":"lily_l4_b87_capacity_report_v1","order_id":"B8.7","hypothesis_id":"L-4","evidence_tier":"E0","edge_claim":"none","producing_git_commit":"0bb7781e0343cfceee12dbde9eee0a9c70436c5b","source_binding":{"gate_path":"experiments/l_4_breadth_b87_phase_a_capacity_gate_v1.json","gate_sha256":"c5f22f2a7153e79f9e13180ba129f6d19cea8759e8a5bc030c35571b19c13972"},"capacity":{"weekly_paired_capacity":465,"planning_mintrl_falsify_by_metric":{"ex_ante_hhi_delta":49,"realized_hhi_delta":49,"top_dependency_delta":49,"n_eff_delta":49},"capacity_outcome":"capacity_funded_all_mandatory_falsification_plans_pending_actual_recalculation"},"validation_seal":{"status":"sealed_not_accessed","accessed":false},"authorizations":{"data":false,"container":false,"market":false,"return":false,"signal":false,"position":false,"covariance":false,"regime":false,"cost":false,"pnl":false,"validation":false,"provider":false,"network":false,"credentials":false,"broker":false,"paid":false,"paper_trade":false,"real_money":false,"activation":false,"execution":false,"report":false,"research_decision":false},"access_counts":{"committed_structural_manifest_read_count":1,"committed_u8_session_date_payload_read_count":1,"market_return_signal_position_covariance_regime_cost_pnl_read_count":0,"validation_access_count":0,"activation_count":0,"execution_count":0},"lifecycle":{"phase_a_capacity_derivation":"locked_once_in_committed_report_only","later_activation_authorized":false,"later_execution_authorized":false,"scientific_execution_preflight":"scripts/run_l_4_breadth_b87_scientific_execution_preflight_v1.py always blocks"}}
